{
  "format": 1,
  "id": "brawl-supernova-2026",
  "block": 1,
  "name": "Brawl Supernova 2026",
  "stages": [
    { "name": "Battlefield", "kind": 1, "role": "starter" },
    { "name": "Pokémon Stadium", "kind": 46, "role": "counterpick" },
    { "name": "Lylat Cruise", "kind": 19, "role": "starter" },
    { "name": "Smashville", "kind": 33, "role": "starter" },
    { "name": "Yoshi's Island", "kind": 13, "role": "starter" },
    { "name": "Final Destination", "kind": 2, "role": "starter" },
    { "name": "Delfino Plaza", "kind": 3, "role": "counterpick" },
    { "name": "Frigate Orpheon", "kind": 12, "role": "counterpick" }
  ],
  "steps": {
    "game1Seconds": [30, 30, 10],
    "later": { "kind": "ban", "count": 2, "optional": true, "seconds": 30 },
    "pickSeconds": 30,
    "graceFrames": 180,
    "casualSeconds": 15,
    "casualGraceFrames": 30
  },
  "dsr": true,
  "clauses": {
    "metaKnight": { "character": 24 }
  },
  "set": {
    "wins": 2,
    "stocks": 3,
    "minutes": 8,
    "timeOut": "judged",
    "ledgeGrabLimit": {
      "limit": 30,
      "tiebreakLimit": 10,
      "characters": [{ "character": 24, "limit": 20, "tiebreakLimit": 6 }]
    },
    "tiebreak": { "stocks": 1, "minutes": 3 },
    "voidAfterTies": 5
  },
  "queue": { "readySeconds": 30, "skipFrames": 90 },
  "characterOrder": { "pickSeconds": 45 },
  "css": { "readySeconds": 60 }
}
